{
  "$schema": "http://json-schema.org/draft-07/schema#",
  "type": "object",
  "additionalProperties": false,
  "required": ["channelId", "description", "type", "notaries", "createdAt", "modifiedAt"],
  "properties": {
    "channelId": {
      "type": "string",
      "minLength": 1
    },
    "description": {
      "type": "string",
      "minLength": 1
    },
    "type": {
      "type": "string",
      "minLength": 1
    },
    "notaries": {
      "type": "array",
      "items": {
        "type": "object",
        "properties": {
          "id": {
            "type": "string",
            "minLength": 1
          },
          "type": {
            "type": "string",
            "minLength": 1
          },
          "config": {
            "type": "object",
            "default": {}
          }
        },
        "required": ["id", "type", "config"]
      }
    },
    "createdAt": {
      "type": "string",
      "minLength": 1
    },
    "modifiedAt": {
      "type": "string",
      "minLength": 1
    }
  }
}
